{
  "anchor_reference": {
    "id": "actenon-transparency-fixture",
    "leaf_index": 2,
    "type": "transparency_log"
  },
  "contract": {
    "name": "receipt_countersignature",
    "version": "v1"
  },
  "receipt_digest": {
    "algorithm": "sha-256",
    "canonicalization": "RFC8785-JCS",
    "value": "d7de58bf7e8d6ef9f46f967161d0ba8ae5444a37210dd9df0626799b97341b81"
  },
  "signature": {
    "algorithm": "EdDSA",
    "encoding": "base64url",
    "key_id": "fixture-counter-2026",
    "value": "yyobgfAW5dTTFb3smzX-dgHu-LauBuOdUv5yhoxLI43Os4vHpPsZR0Ru2zqdgyAQ5rWaV2l3Jp9yAv5TdEEUCg"
  },
  "signed_at": "2026-06-06T12:00:30Z",
  "witness": {
    "id": "actenon-transparency-fixture",
    "type": "service"
  }
}
